<phpunuhi
        xmlns:xsi="http://www.w3.org/2001/XMLSchema-instance"
        xsi:noNamespaceSchemaLocation="../xsd/phpunuhi.xsd"
>

    <translations>

        <set name="php">
            <format>
                <php sort="true"/>
            </format>
            <locales>
                <locale name="de">./de.php</locale>
                <locale name="en">./en.php</locale>
                <locale name="fr">./fr.php</locale>
            </locales>
        </set>

    </translations>

</phpunuhi>
